{
  "topic": "mercator-vs-equal-area",
  "angle": "A projeção de Mercator amplia áreas próximas aos polos; uma projeção equivalente preserva as proporções de área.",
  "audience": "general",
  "category": "geography",
  "tags": ["mapas", "cartografia", "projecoes"],
  "languages": ["pt-BR"],
  "distribution": ["site", "instagram"],
  "visualizationType": "projection-comparison",
  "sources": [
    {
      "id": "usgs-projections",
      "title": "How are different map projections used?",
      "url": "https://www.usgs.gov/faqs/how-are-different-map-projections-used",
      "accessedAt": "2026-10-20",
      "publisher": "U.S. Geological Survey"
    }
  ],
  "claims": [
    {
      "id": "mercator-distortion",
      "text": "A projeção de Mercator distorce muito áreas próximas às regiões polares.",
      "sourceIds": ["usgs-projections"],
      "dataIds": []
    },
    {
      "id": "projection-tradeoff",
      "text": "Um mapa plano não preserva simultaneamente área, forma, distância e direção em toda a Terra.",
      "sourceIds": ["usgs-projections"],
      "dataIds": []
    }
  ],
  "data": [],
  "translations": {
    "pt-BR": {
      "title": "Por que Mercator amplia as regiões polares?",
      "summary": "A escolha da projeção muda a maneira como percebemos o tamanho das regiões no mapa.",
      "insight": "Mercator é útil para certos tipos de navegação, mas amplia áreas em latitudes altas.",
      "paragraphs": [
        {"text": "A projeção de Mercator distorce fortemente as áreas próximas aos polos. Por isso, uma comparação visual de tamanhos feita nesse mapa pode induzir a conclusões erradas.", "claimIds": ["mercator-distortion"]},
        {"text": "Toda projeção plana precisa escolher quais propriedades preservar. Área, forma, distância e direção não podem ser todas mantidas ao mesmo tempo em um mapa do mundo.", "claimIds": ["projection-tradeoff"]}
      ],
      "instagramHook": "O mapa que você conhece muda o tamanho aparente das regiões."
    }
  },
  "visual": {
    "title": "MAPAS MUDAM ESCALAS",
    "subtitle": "Mercator × projeção equivalente",
    "accent": "#7132df"
  }
}
